{
  "type": "com.mbta.ctd.glides.editors_changed.v1",
  "specversion": "1.0",
  "source": "glides.mbta.com",
  "id": "19fdb184-7dd6-4664-8472-04bd6177ec44",
  "time": "2023-01-20T09:30:00-05:00",
  "data": {
    "metadata": {
      "author": {
        "emailAddress": "ainspector@example.com",
        "badgeNumber": "123"
      },
      "inputTimestamp": "2023-01-20T09:29:59-05:00",
      "inputType": "take-over-editing",
      "location": { "todsId": "lakst" }
    },
    "changes": [
      {
        "type": "stop",
        "location": { "todsId": "lakst" },
        "editor": {
          "emailAddress": "binspector@example.com",
          "badgeNumber": "456"
        }
      },
      {
        "type": "start",
        "location": { "todsId": "lakst" },
        "editor": {
          "emailAddress": "ainspector@example.com",
          "badgeNumber": "123"
        }
      }
    ]
  }
}
